Inscription: IE,Inscription: Title,Inscription: Object Type,Inscription: Type,Inscription: Suspected Ancient Location,Inscription: Date (Avg.),Inscription: Date Span,Inscription: Letter Height (m),Areopagus Sponsor,Boule Sponsor,Demos Sponsor,Inscription: Notes
267,Statue Base for an Unknown Kanephoros,Base,Dedication,Outer Courtyard,-87.5,25,0.0080,False,True,True,
268,Statue Base for Ameinokleia Philanthou Phylasiou,Base,Dedication,,-87.5,25,0.0250,False,False,False,
269,Statue Base for an Unknown Hearth-Initiate,Base,Dedication,,-87.5,25,0.0175,False,False,False,
270,"Statue Base for Epiphaneia, Daughter of Athenagoras Meliteus",Base,Dedication,,-85.0,10,0.0160,False,False,False,
271,Honorary Decree of the Synod of Dionysiac Artists in Honor of their Epimelete Philemon,Base,Decree,,-73.0,6,0.0070,False,False,False,
272,"Statue Base for Eusebeia, Daughter of King Ariobarzanes II of Cappadocia",Base,Dedication,,-70.0,10,0.0220,False,False,False,
272,"Statue Base for Athenais, Daughter of King Ariobarzanes II of Cappadocia",Base,Dedication,,-70.0,10,0.0220,False,False,False,
272,"Statue Base for Athenais, Daughter of King Ariobarzanes I of Cappadocia",Base,Dedication,,-70.0,10,0.0245,False,False,False,
272,"Statue Base for King Ariobarzanes II, Son of King Ariobarzanes I, of Cappadocia",Base,Dedication,,-70.0,10,0.0245,False,False,False,
273,"Statue Base for Timothea, Daughter of Medeios Medeiou Peiraieus",Stele,Dedication,,-70.0,10,0.0200,False,False,False,
274,Dedication in Honor of a Tamias,Base,Dedication,,-61.5,1,0.0095,False,True,False,
275,"Statue Base for Medeios Medeiou Peiraieus, Exegete of the Eumolpidai",Base,Dedication,North of the Telesterion,-60.0,10,0.0200,False,True,True,
276,Statue Base for Titus Pinarius,Base,Dedication,,-50.0,10,,False,False,True,
277,"Statue Base for Sophokles Xenokleous Acharneus, Daduch",Base,Dedication,,-50.0,20,0.0260,False,False,False,
278,"Statue Base for Sophokles Xenokleous Acharneus, Daduch",Base,Dedication,,-50.0,20,,False,False,False,
279,Statue Base for Unknown,Base,Dedication,,-50.0,20,0.0195,False,False,False,
280,"Statue Base for Kleo, Daughter of Dionysios Lakrateidou Ikarieus",Base,Dedication,Between the Propylaea,-50.0,20,0.0250,False,False,True,
281,Statue Base for Unknown,Base,Dedication,,-50.0,20,0.0210,False,False,False,
282,Statue Base for Unknown Hearth-Initiate,Stele,Dedication,Between the Propylaea,-50.0,20,0.0090,False,True,True,
283,Statue Base for an Unknown Hearth-Initiate,Base,Dedication,Between the Propylaea,-50.0,20,,False,True,False,
284,Statue Base for Unknown,Base,Dedication,,-50.0,20,0.0135,False,False,False,
285,Statue Base for an Unknown Daduch of Hagnous,Base,Dedication,,-40.0,20,0.0265,False,False,True,
286,Statue Base for Dionysios Athenagorou Meliteus,Base,Dedication,Between the Propylaea,-37.5,25,0.0170,False,False,True,
287,Statue Base for Aion,Base,Dedication,,-32.5,35,0.0130,False,False,False,
288,State Base for Hierophantis Amphiou Philadou,Base,Dedication,,-32.5,35,,False,False,True,
289,Statue Base for Lucius Munatius Plancus,Base,Dedication,South Wall,-36.0,10,0.0360,False,False,True,
290,Propylon Dedicated by Appius Claudius Pulcher,Base,Dedication,Between the Propylaea,-40.0,10,0.1105,False,False,False,
291,"Statue Base of Phaidros Lysiadrou Berenikides, Dedicated by his Daughter Khrysothemis Phaidrou Berenikides",Base,Dedication,,-40.0,10,0.0155,False,False,False,
291,"Statue Base of Q. Caecilius Pomponianus Atticus, Dedicated by Khrysothemis Phaidrou Berenikides",Base,Dedication,,-40.0,10,0.0155,False,False,False,
291,"Statue Base for Lysiades Phaidrou Berenikides, Dedicated by the Demos",Base,Dedication,,-40.0,10,0.0155,False,False,True,
291,"Statue Base for Khrysothemis Phaidrou Berenikides, Dedicated by the Demos",Base,Dedication,,-40.0,10,0.0155,False,False,True,
292,Statue Base for Sempronia L.F. Atratina,Base,Dedication,,-39.5,11,0.0340,False,False,True,
293,Bench Deadicted by Caius Creperius C.F.,Base,Dedication,,-40.0,10,0.0220,False,False,False,
294,Statue Base for Marcus Titius L.F.,Base,Dedication,Between the Propylaea,-35.0,10,0.0380,False,False,False,
295,"Statue Base for Kallikratides Syndromou Trikorysios, Hoplite General",Base,Dedication,South Wall,-32.5,5,0.0345,True,True,True,
296,"Livia Drousilla, Wife of the Emperor Augustus Caesar",Building or Monument,Dedication,,-26.0,10,0.0400,False,False,True,
296,"Statue Base for the Emperor Augustus Caesar, Son of the Divine Iulius, Dedicated by the Demos",Building or Monument,Dedication,,-26.0,10,0.0400,False,False,True,
297,Statue Base for Augustus Caesar as Zeus Boulaios,Base,Dedication,,-22.0,10,0.0400,False,False,False,
298,"Statue Base for Theophrastos Themistokleous Hagnousios, Daduch",Base,Dedication,,-25.0,10,0.0220,False,False,True,
299,"Statue Base for Lamidion. Daughter of Apolexis Ex Oiou, Hearth-Initiate",Base,Dedication,,-25.0,10,0.0150,False,False,False,
300,Honorary Decree for Themistokles Theophrastou Hagnousios,Base,Decree,,-25.0,10,0.0095,False,True,True,
301,"Statue Base for the Daduch Theophrastos, son of the Daduch Themistokles of Hagnousios, Dedicated by the Demos",Base,Dedication,,-20.0,10,0.0235,False,False,True,
301,"Statue Base for the Daduch Themistokles, Son of the Daduch Themistokles, Dedicated by the Demos",Base,Dedication,,-20.0,10,0.0235,False,False,True,
301,"Statue Base Sophokles, Son of Theophrastos, of Hagnous",Base,Dedication,,-20.0,10,0.0235,False,False,True,
302,"Statue Base for an Unknown Hearth-Initiate, son of Themistokles Hagnousios",Base,Dedication,Before the Telestrion,-13.0,24,0.0225,False,False,True,
303,Statue Base For Unknown,Building or Monument,Dedication,,-13.0,24,0.0290,False,False,False,
304,"Statue Base Signed by Antiochos, son of Demetrios of Antioch",Building or Monument,Other/Uncertain,,-13.0,24,0.0110,False,False,False,
305,Statue Base for Polyainos Nikandrou Sounieus,Base,Dedication,,-13.0,24,0.0270,False,True,True,
306,"Altar for Kourotrophos, Dedicated by Theophile",Other/Fragment,Dedication,,-50.5,99,0.0130,False,False,False,
307,"Statue Base for Diotima, Hearth-Initiate",Base,Dedication,,-50.5,99,0.0170,False,False,False,
308,Statue Base for Diodotos Kalliphontos Pamotades,Base,Dedication,,-50.5,99,0.0210,False,False,True,
309,Statue Base Signed by Sosibios,Base,Other/Uncertain,,-50.5,99,0.0200,False,False,False,
310,Fragmentary Law or Epistle,Base,Other/Uncertain,,50.0,300,0.0140,False,False,False,
311,Fragment Letter or Decree,Base,Other/Uncertain,,50.0,300,0.0080,False,False,False,
312,Statue Base for Dionysios Son of Dionysios,Stele,Dedication,,50.0,300,0.0270,True,False,False,
313,Statue Base Dedicated by or for an Exegete,Base,Dedication,,50.0,300,0.0240,False,False,False,
314,Statue Base for Unknown,Base,Dedication,,50.0,300,0.0340,False,False,False,
315,Fragmentary Decree,Base,Decree,,50.0,300,0.0110,False,False,False,
316,Statue Base Unknown,Base,Dedication,,50.0,300,0.0195,False,False,False,
317,Statue Base for an Unknown Hearth-Initiate,Altar,Dedication,,0.0,200,,False,False,False,
318,Statue Base for an Unknown Hearth-Initiate,Base,Dedication,,50.0,300,0.0240,False,False,False,
319,Statue Base for an Unknown Hearth-Initiate,Base,Dedication,,50.0,300,0.0240,False,False,False,
320,Fragmentary Dedication,Base,Dedication,,100.0,400,0.0150,False,False,False,
321,Statue Base for Unknown,Other/Fragment,Other/Uncertain,,100.0,400,0.0210,False,False,False,
322,Statue Base for Unknown,Other/Fragment,Dedication,,100.0,400,0.0475,False,False,False,
323,"Statue Base for Atheno Niketou Hagnousiou, Hearth-Initiate",Base,Dedication,,0.0,50,,True,True,True,
324,"Statue Base for Pammenes Pammenous Marathonios, Exegete of the Eumolpidai",Base,Dedication,Before the Telestrion,13.0,24,0.0300,True,True,True,
325,Statue Base for a Unknown Hierophantis,Base,Dedication,,13.0,24,,False,False,True,
326,Statue Base for Unknown,Base,Dedication,Outer Courtyard,13.0,24,0.0290,False,False,True,
327,Statue Base for Antamenes Leontichou Epieikides,Base,Dedication,Outer Courtyard,13.0,24,0.0280,True,False,True,
328,Altar for Kourotrophos,Base,Dedication,,13.0,24,0.0080,False,False,False,
329,"Statue Base for an Unknown Hearth-Initiate, Daughter of Polycharmos of Azenia",Other/Fragment,Dedication,,-6.5,41,,False,True,False,
330,Statue Base for Polycharmos Polykritou Azenieus,Base,Dedication,,-6.5,41,0.0295,False,False,True,
331,Statue Base for Emperor Tiberius,Base,Dedication,,25.5,23,0.0350,False,False,False,
332,Statue Base for Unknown,Base,Other/Uncertain,,34.0,40,0.0650,False,False,False,
333,Statue Base for Menandros Asklepiodotou Gargettios,Base,Dedication,Before the Telestrion,20.0,10,0.0220,False,False,False,
334,Monument for Emperor Tiberius,Base,Dedication,,20.0,10,0.0450,True,True,True,
335,Monument for Iulia Augusta,Other/Fragment,Dedication,,25.0,10,0.0450,True,True,True,
336,Statue Base for a Priest of Tiberius and Exegete of the Eumolpidai,Base,Dedication,,25.0,10,0.0240,False,False,False,
337,Statue Base for an Unknown Exegete,Base,Dedication,,25.0,10,0.0290,False,False,False,
338,Statue Base for Unknown,Base,Dedication,,25.0,10,0.0235,False,False,False,
339,Statue Base for Unknown,Base,Dedication,,37.5,25,0.0250,False,False,False,
340,Statue Base for Unknown,Base,Dedication,,37.5,25,0.0230,True,True,True,
341,Epistyle of Building Dedicated by the Priestess Kleo Eukleous of Phyla,Base,Dedication,,45.0,40,0.0350,False,False,False,
342,Monument Dedicated by the Priestess Kleo Eukleous of Phyla,Base,Dedication,,45.0,40,0.0520,False,False,False,
343,Statue Base Dedicated by the Priestess Kleo Eukleous of Phyla,Altar,Dedication,,45.0,40,0.0230,False,False,False,
344,"Statue Base for Polycharmos Eukleous Marathonios, High Priest of Tiberius",Base,Dedication,Before the Telestrion,33.5,7,0.0300,False,False,False,
345,Statue Base for Titus Statilius Lamprias,Base,Dedication,,43.0,10,,True,True,True,
346,Statue Base Dedicated by Kleopatra Iophontos Deiradiotou and Her Son,Base,Dedication,,50.0,20,0.0230,False,False,False,
347,"Statue Base for P. Papinus Statius, Dedicated by the Areopagus",Base,Dedication,,50.0,50,0.0215,True,False,True,
347,"Statue Base for a Proconsul, Dedicated by the Demos",Base,Dedication,,50.0,50,0.0215,False,False,False,
348,Statue Base for Diokles Themistokleous Hagnousios,Base,Dedication,,50.0,20,0.0200,True,True,True,
349,"Statue Base for Athenais, Daughter of Diokles Hagnousios",Stele,Dedication,Before the Telestrion,50.0,20,,True,True,True,
350,Statue Base for Marcus Porcius Cato,Base,Dedication,,50.0,20,0.0300,False,False,False,
351,"Statue Base for Seilon Apolloniou Meliteus, Hearth-Initiate",Base,Dedication,,50.0,20,0.0180,True,True,True,
352,"Statue Base for Caius Caecilius Kasios, Acharneus",Base,Dedication,Before the Telestrion,50.0,20,0.0300,True,True,True,
353,Statue Base for an Unknown Daughter of Statilius of Sphettos,Building or Monument,Dedication,,50.0,20,0.0250,True,True,True,
354,"Architrave with Dedication by Tiberius Klaudios Eukles Sostratou, Priest of Iulia Agrippina Sebaste",Building or Monument,Dedication,,54.5,9,,False,False,False,
355,Statue Base for an Unknown Brother of the Priest Tiberius Klaudios Eukles Sostratou,Base,Dedication,,54.5,9,,False,False,False,
356,Statue Base for Tiberius Klaudios Nouios Philinou of Oion,Base,Dedication,,55.0,10,0.0250,False,False,False,
357,"Statue Base for Tiberius Klaudios Demostratos Ti. Klaudii Neikotelous Sounieus, Hearth Initiate",Base,Dedication,,55.0,10,0.0170,False,False,False,
358,Statue Base for Klaudios Asklepiodoros Gargettios,Base,Dedication,,55.0,10,0.0250,False,False,False,
359,Statue Base for an Exegete,Base,Dedication,,75.0,50,0.0240,False,False,False,
360,Contract Concerning Iulius Nikanor,Building or Monument,Other/Uncertain,,60.0,20,0.0130,False,False,False,
361,Statue Base for Tiberius Klaudios Nouios of Oion,Building or Monument,Dedication,,60.0,10,,False,False,False,
362,"Status Base for Iulius Nikanor, New Homer and New Themistokles",Base,Dedication,,60.0,10,0.0220,True,True,True,
363,Entablature,Base,Dedication,Before the Telestrion,99.0,78,0.0400,False,False,False,
364,Monument for Klaudia Alkia,Base,Dedication,,65.0,10,0.0140,False,False,False,
365,Statue Base for Titus Flavius Sophokles T. Flavii Kononos Sounieus,Base,Dedication,,75.0,10,0.0200,False,False,False,
366,Statue Base for Titus Flavius Konon Kononos Sounieus,Base,Dedication,,77.5,5,0.0230,False,False,False,
367,Statue Base for Titus Flavius Sophokles Kononos Sounieus,Base,Dedication,,77.5,5,0.0250,False,False,False,
368,Statue Base for Unknown,Base,Dedication,,77.5,5,0.0320,False,False,False,
369,"Building Dedicated by Klaudia Tartarion, Priestess of Demeter and Kore",Base,Dedication,,77.5,5,,False,False,False,
370,"Statue Base for Publius Fulvius Metrodoros, Hearth-Initiate",Base,Dedication,,85.0,10,0.0100,False,False,False,
371,"Statue Base for Klaudia Philoxena, Hierophantis",Base,Dedication,,97.5,15,0.0250,False,False,False,
372,Statue Base for an Unknown Individual,Base,Dedication,,97.5,15,0.0280,True,False,False,
373,"G. Kl. Seilianos Polykritos, Hearth-Initiate",Building or Monument,Dedication,,97.5,15,,False,False,False,
374,Statue Base for Zopyros Zopyrou Piraieos,Base,Dedication,,97.5,15,0.0230,False,False,False,
375,Statue Base for an Unknown Individual,Base,Dedication,,97.5,15,,False,False,False,
376,Statue Base for an Unknown Individual,Base,Dedication,,97.5,15,0.0230,False,False,False,
377,Statue Base for the Unknown Wife of Ammonios of Kholleidai,Base,Dedication,,87.5,25,0.0190,False,False,False,
378,Statue Base for Eraton Eratonos Besaieus,Base,Dedication,,50.5,99,0.0280,True,True,False,
379,"Statue Base for an Unknown Individual, Dedicated by a Priestess",Stele,Dedication,,50.5,99,0.0140,False,False,False,
380,"Statue Base for Athenais, Granddaughter of a Hierophantis",Base,Dedication,Before the Telestrion,50.5,99,0.0120,False,False,False,
381,Statue Base for a [-]ppos Herakleitou Gargettios,Base,Dedication,,50.5,99,0.0290,False,False,True,
382,Statue Base for Kl. Theophilos and Kl. S[-],Base,Dedication,,50.5,99,0.0130,False,False,False,
383,Statue Base for a T. Flavius,Building or Monument,Dedication,,50.5,99,0.0130,True,True,True,
384,"Statue Base for a L. Pompeios, Hearth-Initiate",Base,Dedication,,50.5,99,0.0400,False,False,False,
385,Statue Base for a L. Pompeios,Base,Dedication,,50.5,99,0.0100,False,False,False,
386,Statue Base Signed by Agathokles Agathokleous Kephisieus,Base,Other/Uncertain,,50.5,99,0.0080,False,False,False,
387,Altar Dedicated by Daughter of Dionysios Phalereus,Base,Dedication,,50.5,99,0.0600,False,False,False,
388,Statue Base for an Unknown Individual,Base,Dedication,,50.5,99,0.0275,False,False,False,
389,Son of Tryphon Phylasios,Building or Monument,Dedication,,50.5,99,0.0900,True,True,True,
390,Altar Dedicated to Artemis,Base,Dedication,,50.5,99,0.0290,False,False,False,
391,Statue Base for an Unknown Hearth-Initiate,Base,Dedication,,50.5,99,0.0205,False,False,False,
392,Catalogue?,Base,Other/Uncertain,,100.5,199,0.0285,False,False,False,
393,Statue Base for an Unknown Hearth-Initiate,Base,Dedication,,100.5,199,0.0200,False,False,False,
394,Dedication to Dionysios Lenaios,Base,Dedication,,100.5,199,0.0100,False,True,False,
395,Statue Base for a Hearth-Initiate,Base,Dedication,,100.5,199,0.0210,False,False,False,
396,Statue Base for an Unknown Hearth-Initiate,Base,Dedication,,100.5,199,0.0160,False,False,True,
397,Statue Base for an Unknown Individual,Base,Dedication,,100.5,199,0.0200,False,False,False,
398,Statue Base for Kourtia Stratonike,Base,Dedication,Before the Telestrion,100.5,199,0.0430,False,False,False,
399,"Statue Base for Kallisto, Daughter of Kallimakhos",Base,Dedication,Before the Telestrion,100.5,199,0.0340,False,False,False,
400,Bomiskos for Iakkhos,Base,Dedication,,100.5,199,0.0150,False,False,False,
401,Bomiskos for Kourotrophos,Base,Dedication,,100.5,199,0.0130,False,False,False,
402,Statue Base for an Unknown Individual,Base,Dedication,,100.5,199,0.0310,True,True,True,
403,Statue Base for an Unknown Individual,Base,Dedication,,150.5,299,,False,False,False,
404,Statue Base for an Unknown Individual,Base,Dedication,,150.5,299,0.0290,False,False,False,
405,Statue Base(?) For an Unknown Individual,Base,Dedication,,150.5,299,0.0300,False,False,False,
406,Statue Base for an Unknown Individual,Base,Dedication,,150.5,299,0.0280,False,False,False,
407,Statue Base for an Unknown Individual,Base,Dedication,,150.5,299,0.0320,False,False,False,
408,Dedicatory Base for an Unknown Figure,Base,Dedication,,150.5,299,0.0295,False,False,False,
409,Statue Base(?) for Unknown,Altar,Other/Uncertain,,150.5,299,0.0480,False,False,False,
410,Statue Base(?) For Unknown,Base,Dedication,,150.5,299,0.0680,True,False,True,
411,Monument Dedicated by an Unknown Party,Base,Other/Uncertain,,150.5,299,0.0530,False,False,False,
412,Statue Base for an Unknown Individual,Altar,Dedication,,150.5,299,0.0300,False,False,False,
413,Statue Base for an Unknown Individual,Base,Dedication,,150.5,299,0.0220,False,False,False,
414,Statue Base for an Unknown Individual,Other/Fragment,Dedication,,150.5,299,0.0250,True,True,True,
415,Statue Base for an Unknown Individaul,Base,Dedication,,150.5,299,0.0370,False,False,False,
416,Statue Base for an Unknown Hearth-Initiate,Base,Dedication,,150.5,299,0.0130,False,False,False,
417,Statue Base(?) for an Unknown Individual,Base,Dedication,,150.5,299,0.0300,False,False,False,
418,Statue Base for an Unknown Individual,Base,Dedication,,150.5,299,0.0260,False,False,False,
419,Statue Base for an Unknown Individual,Base,Dedication,,150.5,299,0.0300,False,False,False,
420,Statue Base(?) for an Unknown Individual,Base,Dedication,,150.5,299,0.0690,False,False,False,
421,Statue Base for an Unknown Individual,Altar,Dedication,,150.5,299,0.0260,False,False,True,
422,Statue Base for an Unknown Emperor,Altar,Dedication,,150.5,299,0.0400,False,False,False,
423,Statue Base for an Unknown Individual,Base,Dedication,,150.5,299,0.0700,False,False,False,
424,Statue Base for an Unknown Emperor(?),Base,Dedication,,150.5,299,0.0600,False,False,False,
425,Statue Base for an Unknown Individual,Base,Dedication,,150.5,299,0.0310,False,False,False,
426,Statue Base for an Unknown Individual,Base,Dedication,,150.5,299,0.0190,False,False,False,
427,Statue Base for an Unknown Individual,Base,Dedication,Before the Telestrion,150.5,299,0.0290,True,True,False,
428,Statue Base for an Unknown Individual,Base,Dedication,,150.5,299,0.0180,False,False,False,
429,Statue Base for an Unknown Hearth-Initiate(?),Base,Dedication,,150.5,299,0.0170,False,False,False,
430,Statue Base for an Unknown Individual,Base,Dedication,,150.5,299,0.0280,False,False,False,
431,Statue Base for an Unknown Hearth-Initiate,Base,Dedication,,150.5,299,0.0275,False,False,False,
432,Dedication by a Woman for her Family,Base,Dedication,,150.5,299,0.0150,False,False,False,
433,"Statue Base for an Unknown Hierophantis, Daughter of Perikles of Oion",Base,Dedication,,112.5,25,0.0270,False,False,False,
433,"Statue Base for Ti. Kl., the Hierophant, Kallikratidou Trikorysios",Base,Dedication,,112.5,25,0.0250,False,False,False,
434,Statue Base Signed by Sotas and [-],Building or Monument,Other/Uncertain,,125.0,40,0.0220,False,False,False,
435,"Statue Base for an Unknown Individual, Dedicated by the Eumolpidai, Lykomidai",Base,Dedication,Before the Telestrion,125.0,40,0.0200,False,False,False,
436,Statue Base for an Unknown Individual,Base,Dedication,Before the Telestrion,125.0,40,0.0170,False,False,False,
437,Statue Base(?) for an Unknown Individual,Base,Dedication,,125.0,40,0.0290,False,False,False,
438,"Statue Base for Ti. Kl. Attikos Herodes Kl. Attikou Marathonios, 'Son of Hellas'",Base,Dedication,,115.0,10,0.0150,False,False,False,
439,Statue Base for Agrius Saturninus,Base,Dedication,Before the Telestrion,122.0,10,0.0250,True,False,False,
440,Dedicatory Base in Honor of Ael. Lysistrate,Base,Dedication,,122.0,10,,True,True,True,
441,"Statue Base for Athenaios Athenaiou Phlyeus, Hearth-Initiate",Base,Dedication,,119.5,11,,True,True,False,
442,"Statue Base for T. Vipsanius [-] Flavianos Kephisieus, Hearth-Initiate",Base,Dedication,,132.5,15,0.0150,False,False,False,
443,Statue Base for a Son of Heroxenos of Marathon,Base,Dedication,,137.5,25,0.0220,False,False,False,
444,Statue Base(?) for G. Memmios Sabeinos Peisandros,Base,Dedication,,128.0,10,,False,False,False,
445,Statue Base for Thrasyllos of Kholleidai,Base,Dedication,,135.0,10,0.0210,False,False,False,
446,Altar Dedicated to Hadrian,Base,Dedication,,132.0,10,0.0200,False,False,False,
447,Altar Dedicated by the Akhaioi,Base,Dedication,Outer Courtyard,136.0,10,0.1000,False,False,False,
448,"Dedicatory Inscriptions on Two Triumphal Arches, Dedicated by the Panhellenes to the Two Goddesses and the Emperor",Base,Dedication,Outer Courtyard,136.5,3,0.1750,False,False,False,
449,Dedication of an Aquaduct by an Uncertain Emperor,Base,Dedication,,127.5,21,0.0430,False,False,False,
450,Dedicatory Architrave Concerning the Eleusinia,Base,Other/Uncertain,South Wall,127.5,21,0.1300,False,False,False,
451,Dedication Concerning an Unknown Emperor,Base,Other/Uncertain,South Wall,150.5,99,0.1150,False,False,False,
452,Architrave Fragment,Base,Other/Uncertain,,150.5,99,0.1245,False,False,False,
453,Statue Base for the Deified Hadrian Panhellenios,Base,Dedication,Outer Courtyard,160.0,44,0.1100,False,False,False,
454,"Statue Base for an Unknown Hierophantis, Daughter of a Demetrios",Base,Dedication,,160.0,44,0.0220,False,False,False,
455,"Statue Base for L. Vipsanios Aiolion Phlyeus, Exegete of the Eumolpidai",Base,Dedication,,145.0,10,0.0260,True,True,True,
456,"Statue Base for Relative of L. Vipsanios Aiolion, Exegete of the Eumolpidai",Base,Dedication,,145.0,10,0.0315,False,False,False,
457,Base Dedicated by the Samians,Base,Dedication,,145.0,10,0.0320,False,False,False,
458,"Statue Base for Iun. [-] Meletine, Daughter of Iun. Patron of Berenikidai, Hearth-Initiate",Base,Dedication,,145.0,10,0.0110,False,False,False,
459,"Statue Base for Nummia Kleo, Hearth-Initiate",Base,Dedication,,145.0,10,0.0300,False,False,False,
460,Statue Base for Ti. Kl. Attikos of Marathon,Base,Dedication,,125.0,50,0.0230,False,False,False,
461,"Statue Base Galeria Annia Faustina Sebaste, Daughter of Emperor Antoninus and Wife of M. Aur. Verus",Base,Dedication,,153.0,14,0.0445,False,False,False,
461,"Statue Base for Domitia Lucilla, Daughter of M. Aur. Verus",Base,Dedication,,153.0,14,0.0615,False,False,False,
462,"Statue Base for Nummios Nigreinos, Hierokeryx",Base,Dedication,Before the Telestrion,150.0,10,,False,False,False,
463,Statue Base for Menandra of Ephesos,Base,Dedication,,150.0,50,0.0170,False,False,False,
464,Statue Base D. Iun. Menneas D. Iun. Patronos Berenikides,Base,Dedication,,150.0,50,0.0170,False,False,False,
465,"Statue Base for Phirmos Gargettios, Hierophant",Base,Dedication,Outer Courtyard,150.0,50,0.0180,False,False,False,
466,"Statue Base for D. Iun. Peiraieus, Hierophant",Column/Herm,Dedication,,150.0,50,0.0210,False,False,False,
467,"Statue Base for an Unknown Hearth-Initiate, Relative of the Daduch Ti. Kl. Lysiades",Base,Dedication,,150.0,50,,False,False,False,
468,Statue Base for Ael. Praxagoras of Melite,Base,Dedication,,150.0,50,0.0330,False,False,False,
469,Statue Base for an Unknown Individual,Base,Dedication,,150.0,50,0.0260,False,False,False,
470,"Statue Base for Klementiane, Daughter of Arrian",Base,Dedication,,175.0,50,0.0160,False,False,False,
471,Statue Base for an Unknown Emperor,Base,Dedication,,175.0,50,0.0800,False,False,False,
472,Statue Base for an Unknown Member of the Klaudii of Melite,Base,Dedication,,175.0,50,0.0250,False,False,False,
473,"Statue Base for Sergius Salvidius Orfitus, Dedicated by The Areopagus, Boule, and Demos",Base,Dedication,South Wall,155.0,10,0.0550,True,True,True,
473,"Statue Base for Calpurnia Lepida, Daughter of L., Wife of Scipio Orfitus, Dedicated by the Areopagus, Boule, and Demos",Base,Dedication,South Wall,155.0,10,0.0550,True,True,True,
473,"Statue Base for Sergius Calpurius Scipio Orfitus, Son of Scipio Orfitus, Dedicated by the Areopagus, Boule, and Demos",Base,Dedication,South Wall,155.0,10,0.0550,True,True,True,
473,"Statue Base for L. Calpurnius Scipio, son of Orfitus, Dedicated by the Areopagus, Boule, and Demos",Base,Dedication,South Wall,155.0,10,0.0550,True,True,True,
474,"Statue Base for P. Ael. Teimosthenes Berenikides, Son of Ael. Zenon, Hearth-Initiate",Base,Dedication,South Wall,155.0,10,0.0200,False,False,False,
475,"Statue Base for Elpinike, Daughter of Herodes Attikos, Hearth-Initiate",Base,Dedication,,155.0,10,0.0245,False,False,False,
476,"Statue Base for Regilla, Wife of Herodes Attikos",Base,Dedication,Before the Telestrion,160.0,10,0.0280,False,False,False,
477,"Statue Base for Ti. Kl. Appios Ateilios Bradoua, Son of Kl. Herodes, Hearth-Initiate",Base,Dedication,,162.5,5,0.0120,False,False,False,
478,Statue Base for Ael. Praxagoras Themistokleous Meliteus,Base,Dedication,South Wall,165.0,10,0.0320,False,False,False,
479,Statue Base for Aelius Praxagoras Themistokles Meliteus,Base,Dedication,South Wall,165.0,10,0.0280,False,False,False,
480,"Statue Base for an Unknown Son of P. Ael. Praxagoras Meliteus, Hearth-Initiate",Base,Dedication,South Wall,165.0,10,0.0460,False,False,False,
481,"Statue Base for Fl. Xenion Marathonsios, Hearth-Initiate, and Others",Base,Dedication,,165.0,10,,False,False,False,
482,Altar(?) for the Health of M. Aurelius and L. Verus,Base,Dedication,,165.0,8,0.0150,False,False,False,
483,"Statue Base T. Fl. Hierophantes Paianieus, Son of T. Fl. Alkibiades",Base,Dedication,Before the Telestrion,167.0,10,0.0130,True,True,True,
