484,"Dedicatory Verse in Honor of Herodes Attikos, Not from the Sanctuary",Base,Verse,,162.0,0,0.0200,False,False,False,
485,"Statue Base for M. Aur. Miltiades, Son of Agathokles of Marathon, Hearth-Initiate",Base,Dedication,,165.0,10,,False,False,False,
486,"Statue Base for the Savior Gods/Godesses of Brotherly Emperors, Dedicated by the Polis during the Epimelitea of Herodes",Base,Dedication,,171.0,10,0.0920,True,True,True,
486,"Statue Base for the Savior Gods/Godesses of the Brotherly Emperors, Dedicated By the Polis During the Epimelitea of Herodes",Base,Dedication,,171.0,10,0.0920,True,True,True,
487,Statue Base for T. Fl. Euthykomas Paianieus,Altar,Dedication,,166.0,10,0.0270,True,False,False,
488,Statue Base for T. Fl. Menandros Paianieus,Stele,Dedication,South Wall,166.0,10,0.0370,True,False,False,
490,"Statue Base for M. Iul. Apellas Marathonios, Archon of the Eumolpidai",Altar,Dedication,Before the Telestrion,170.0,10,0.0280,True,False,False,
491,"Statue Base for Fl. Xenion of Marathon, Archon of the Panhellenes",Altar,Dedication,,170.0,10,0.0140,False,False,False,
492,"Statue Base for Iul. Theodotos Meliteus, Son of Sophist Iul. Theodotos, Archon of the Kerykex",Altar,Dedication,Before the Telestrion,170.0,10,0.0290,True,True,True,
493,"Statue Base for Ael. Kephisodora, Daughter of Daduch Kl. Lysiades",Building or Monument,Dedication,,170.0,10,0.0250,True,False,False,
494,Herm Honoring the Hierophant who Saved the Hiera During the Kostoboci Invasion,Building or Monument,Dedication,,176.0,10,0.0090,False,False,False,
495,Statue Base for M. Aurelius,Base,Dedication,Before the Telestrion,173.5,3,0.0370,False,False,False,
496,Statue Base for M. Aurelius,Base,Dedication,Outer Courtyard,176.0,8,0.0460,False,False,False,
497,Statue Base for M. Aurelius(?),Building or Monument,Dedication,,176.0,8,0.0450,False,False,False,
498,"Statue Base for Asklepios, Dedicated by Herodes",Building or Monument,Dedication,,175.0,0,0.0270,False,False,False,
499,Dedicatory Architrave of the Greater Propylaea,Building or Monument,Dedication,,175.0,10,0.2225,False,False,False,
500,Aedicula Block with Hierophant's Title,Base,Dedication,Outer Courtyard,175.0,10,0.0950,False,False,False,
501,"Statue Base for Iun. Melitine, Hierophantis",Base,Dedication,,187.5,25,0.0270,False,False,False,
502,"Statue Base for Isidote, Daughter of Isaios, Hierophantes",Base,Dedication,Before the Telestrion,184.0,16,0.0200,False,False,False,
503,"Statue Base for L. Memmios, Altar-Priest, of Thorikos",Other/Fragment,Dedication,Before the Telestrion,178.5,3,0.0250,True,True,True,
504,Dedicatory Base for the Aparkhe,Base,Dedication,North of the Telesterion,183.0,12,0.0280,False,False,False,
505,Statue Base for the Deified M. Aurelius,Base,Dedication,Outer Courtyard,181.0,2,0.0765,False,False,False,
506,"Statue Base for Lucilla, Daughter of M. Aurelius",Base,Dedication,Outer Courtyard,181.0,2,0.0600,False,False,False,
507,"Statue Base for Deified Faustina, Wife of M. Aurelius",Base,Dedication,,181.0,2,0.1000,False,False,False,
508,"Statue Base of Deified Faustina, Wife of M. Aurelius",Base,Dedication,Outer Courtyard,181.0,2,0.0850,False,False,False,
509,"Statue Base for Sabina, Daughter of M. Aurelius",Base,Dedication,Outer Courtyard,181.0,2,0.0575,False,False,False,
510,"Statue Base for Faustina, Daughter of M. Aurelius",Base,Dedication,Outer Courtyard,181.0,2,0.0600,False,False,False,
511,"Statue Base for Praxagora, Daughter of Demostratos of Melite, Hearth-Initiate",Base,Dedication,Before the Telestrion,182.5,5,0.0240,False,False,False,
512,Statue Base for Unknown Dedicated by Ael. Philiste,Base,Dedication,,182.5,5,0.0310,False,False,False,
513,Letter by the Emperor Commodus to the Athenians Concern the Archonship of the Eumolpidai,Base,Epistle,,186.5,7,0.0180,False,False,False,
514,Catalog of the Prytaneis of the Tribe of Antiokhis,Stele,Other/Uncertain,South Wall,191.0,10,0.0110,False,False,False,
515,"Statue Base for the Hierophant who Saved the Hiera During the Kostoboki Invasion, Probably Not from the Sanctuary",Base,Dedication,,196.0,10,0.0420,False,False,False,
516,Statue Base for the Hierophant who Saved the Hiera During the Invasion of the Kostoboki.,Column/Herm,Dedication,North of the Telesterion,196.0,10,0.0265,False,False,False,
517,Statue Base(?) for an Unknown Individual,Base,Dedication,,202.0,18,0.0290,False,False,True,
518,Based Dedicated in Honor of the Emperor Septimius Severus and the Empress Iul. Domna,Base,Dedication,,196.5,3,0.0230,False,False,False,
519,Statue Base for the Empress Iul. Domna,Base,Dedication,,196.5,3,,True,True,True,
520,"Statue Base for Kl. Themistokleia, Daughter of the Daduch Kl. Philippos, Hearth-Initiate",Base,Dedication,,187.5,25,0.0300,False,False,False,
521,"Statue Base for Kl. Menandra, Daughter of Kl. Philippos",Base,Dedication,,187.5,25,0.0350,False,False,False,
522,"Statue Base for Nikostrate Menneou Berenikidou, Hearth-Initiate",Base,Dedication,,187.5,25,0.0220,True,False,True,
523,"Statue Base for Ael. Epilampsis, Daughter of Ael. Gelos of Phaleron, Priestess of Demeter and Kore",Other/Fragment,Dedication,Before the Telestrion,187.5,25,0.0160,False,False,False,
524,Statue Base for an Unknown Daughter of T. Fl. Leosthenes of Paiania,Base,Dedication,,187.5,25,0.0170,False,False,False,
525,Base Dedicated by an Unknown Party,Base,Dedication,,187.5,25,0.0200,False,False,False,
526,List of Men and WOmen,Base,Other/Uncertain,,150.5,99,0.0090,False,False,False,
527,"Dedication by Neokleides, Victor in the Eleusinia",Base,Dedication,,150.5,99,0.0120,False,False,False,
528,Herm Honoring Demetrios Apolloniou Marathonios,Base,Dedication,,150.5,99,0.0200,True,False,False,
529,Herm Honoring Demetrios Apolloniou Marathonios,Base,Dedication,,150.5,99,,True,False,False,
530,"Relief Dedicated by Alkamenes, Pyrphoros",Base,Dedication,,150.5,99,0.0085,False,False,False,
531,Statue Base for an Unknown Exegete of the Eumolpidai,Base,Dedication,Before the Telestrion,150.5,99,0.0195,False,False,False,
532,Dedicatory Base for the Aparkhe,Base,Dedication,Outer Courtyard,150.5,99,0.0360,False,False,False,
533,Statue Base for an Unknown High-Priest,Base,Dedication,,150.5,99,0.0150,False,False,False,
534,Statue Base for an Unknown [-]mmios,Base,Dedication,,150.5,99,0.0180,False,False,False,
535,Statue Base for a Hearth-Initiate,Base,Dedication,,150.5,99,0.0280,False,False,False,
536,"Statue Base for Lolliane, Daughter of Glaukos",Base,Dedication,,150.5,99,0.0295,False,False,False,
537,Statue Base for an Unknown Individaul,Base,Dedication,,150.5,99,0.0120,False,False,False,
538,Statue Base(?) for an Unknown Individual,Base,Dedication,,150.5,99,0.0260,False,False,False,
539,Statue Base for an Unknown Individual,Base,Dedication,,150.5,99,0.0300,True,True,True,
540,Statue Base for an Unknown Individual,Base,Dedication,,150.5,99,0.0260,False,False,False,
541,Statue Base for an Unknown Individual,Base,Dedication,,150.5,99,0.0250,False,False,False,
542,Statue Base for an Unknown Individual,Altar,Dedication,,150.5,99,0.0340,False,False,False,
543,Statue Base for an Unknown Klaudios,Base,Dedication,,150.5,99,0.0260,False,False,False,
544,Statue Base for an Unknown Exegete,Base,Dedication,,150.5,99,0.0345,False,False,False,
545,Statue Base for an Unknown Exegete of the Eumolpidai,Base,Dedication,,150.5,99,0.0330,False,False,False,
546,Statue Base for Praxagoras of Melite,Base,Dedication,,150.5,99,0.0220,False,False,False,
547,Statue Base(?) for an Unknown Individual,Base,Dedication,,150.5,99,0.0220,False,False,False,
548,Statue Base for an Unknown Individual,Base,Dedication,,150.5,99,0.0230,False,False,False,
549,Statue Base for an Unknown Priestess of Demeter and Kore,Base,Dedication,,150.5,99,0.0300,False,False,False,
550,Statue Base for an Unknown Exegete(?) of the Eumolpidai,Base,Dedication,,150.5,99,0.0500,False,False,False,
551,Large Monument in Honor of an Unknown Hearth-Initiate,Base,Dedication,,150.5,99,0.0430,False,False,False,
552,Regulation(?) Concerning Dedications in the Sanctuary,Column/Herm,Edict/Regulation,,150.5,99,0.0330,False,False,False,
553,Measuring Table,Base,Other/Uncertain,,150.5,99,0.0255,False,False,False,
554,Fragmentary Inscription from an Architrave,Base,Other/Uncertain,,150.5,99,0.0330,False,False,False,
555,Fragment from an Architectural Block,Base,Other/Uncertain,,150.5,99,0.0750,False,False,False,
556,Fragment on an Architectural(?) Block,Base,Other/Uncertain,,150.5,99,0.0880,False,False,False,
557,Statue Base for an Unknown Individual,Building or Monument,Dedication,,150.5,99,0.0430,False,False,False,
558,Statue Base for an Unknown Son or Daughter of a Nummios,Building or Monument,Dedication,,150.5,99,0.0205,True,True,True,
559,Base Dedicated by an Unknown Party,Base,Dedication,,150.5,99,0.0270,False,False,False,
560,Statue Base for an Unknown Individual,Base,Dedication,,150.5,99,0.0300,False,False,False,
561,Statue Base for an Unknown Individual,Base,Dedication,,150.5,99,0.0270,False,False,False,
562,Statue Base for an Unknown Individual,Base,Dedication,,150.5,99,0.0240,False,False,False,
563,Statue Base for an Unknown Individual,Base,Dedication,,150.5,99,0.0260,False,False,False,
564,Statue Base for an Unknown Individual,Base,Dedication,,150.5,99,0.0330,False,False,False,
565,Statue Base for an Unknown Individual,Base,Dedication,,150.5,99,0.0290,False,False,False,
566,Statue Base for an Unknown Individual,Base,Dedication,,150.5,99,0.0280,False,False,False,
567,Statue Base for an Unknown Individual,Base,Dedication,,150.5,99,0.0310,False,False,False,
568,Statue Base for an Unknown Hearth-Initiate,Base,Dedication,,150.5,99,0.0230,False,False,False,
569,Statue Base for an Unknown Individual,Base,Dedication,,150.5,99,0.0310,False,False,False,
570,Statue Base for an Unknown Individual,Base,Dedication,,150.5,99,0.0210,True,True,True,
571,Statue Base for an Unknown Individual,Stele,Dedication,,150.5,99,0.0400,True,True,True,
572,Statue Base(?) for an Unknown Individual,Column/Herm,Dedication,,150.5,99,0.0340,True,False,True,
573,Statue Base for an Unknown Individual,Base,Dedication,,150.5,99,0.0200,True,True,True,
574,Statue Base for an Unknown Individual,Base,Dedication,,150.5,99,0.0270,True,False,False,
575,Statue Base(?) for an Unknown Individual,Base,Dedication,,150.5,99,0.0290,False,False,True,
576,Statue Base for an Unknown Individual,Base,Dedication,,150.5,99,0.0250,True,False,False,
577,Herm in Honor of an Unknown Individual,Base,Dedication,,150.5,99,0.0190,False,True,False,
578,Statue Base for an Unknown Individual,Base,Dedication,,150.5,99,0.0360,False,True,False,
579,Statue Base for an Unknown Individual,Base,Dedication,,150.5,99,0.0285,True,False,False,
580,Statue Base for an Unknown Individual,Base,Dedication,,150.5,99,0.0550,False,False,False,
581,Statue Base for an Unknown Individual,Base,Dedication,,150.5,99,0.0295,False,False,False,
582,Statue Base for an Unknown Individual,Base,Dedication,,150.5,99,0.0210,False,False,False,
583,Statue Base for an Unknown Individual,Base,Dedication,,150.5,99,0.0375,False,False,False,
584,Dedication(?) by and Unknown Party,Stele,Dedication,,250.5,99,0.0135,False,False,False,
585,Statue Base for an Unknown Individual,Base,Dedication,,250.5,99,0.0135,False,False,False,
586,Epigram,Column/Herm,Verse,,250.5,99,0.0160,False,False,False,
587,"Statue Base for T. Fl. Ateiemtos Son of T. Fl. Agathon of Peiraieus, Hearth-Initiate",Column/Herm,Dedication,,250.5,99,0.0300,True,False,False,
588,"Statue Base for Sabeiniane Hamillo, Priestess of Athena Polias, Probably Not from the Sanctuary",Other/Fragment,Dedication,,250.5,99,0.0240,True,True,True,
589,Base Dedicated by Philoi,Base,Other/Uncertain,Outer Courtyard,250.5,99,0.0155,False,False,False,
590,Statue Base for an Unknown Daughter of an Unknown Pythokhrestos Exegete,Base,Dedication,,250.5,99,0.0200,False,False,False,
591,Statue Base for an Unknown Hearth-Initiate,Base,Dedication,,250.5,99,,False,False,False,
592,Statue Base for an Unknown Individual,Base,Dedication,,250.5,99,0.0210,False,False,False,
593,Statue Base for an Unknown Pompeia A[-],Base,Dedication,,250.5,99,0.0230,False,False,False,
594,Statue Base for an Unknown Priestess of Demeter and Kore,Base,Dedication,,250.5,99,0.0400,False,False,False,
595,Statue Base(?) Celebrating a Victory,Base,Dedication,,250.5,99,0.0170,False,False,False,
596,Statue Base for an Unknown Individual,Base,Dedication,,250.5,99,0.0265,False,False,False,
597,Statue Base(?) for and Unknown Emperor,Base,Dedication,,250.5,99,,False,False,False,
598,Dedicatory Base for an Unknown Individual,Base,Dedication,,250.5,99,0.0275,False,False,False,
599,Statue Base for P. Ael. [-],Base,Dedication,,250.5,99,0.0265,False,False,False,
600,Base Dedicated by Unknown Party,Base,Dedication,,250.5,99,0.0140,False,False,False,
601,Statue Base for Unknown Official,Base,Dedication,,250.5,99,0.0300,False,False,True,
602,Statue Base(?) for an Unknown Individual,Base,Dedication,,250.5,99,0.0260,False,False,False,
603,Statue Base(?) for an Unknown Individual,Base,Dedication,,250.5,99,0.0300,False,False,False,
604,Statue Base for an Unknown Individual,Base,Dedication,,250.5,99,,True,True,True,
605,Statue Base for an Unknown Individual,Base,Dedication,,250.5,99,0.0360,False,False,False,
606,Statue Base for an Unknown Individual,Base,Dedication,,250.5,99,0.0300,False,False,False,
607,Statue Base for an Unknown Individual,Base,Dedication,,250.5,99,0.0245,False,False,False,
608,Statue Base(?) for an Unknown Individual,Base,Dedication,,250.5,99,0.0185,False,False,False,
609,Statue Base for an Unknown Individual,Base,Dedication,,250.5,99,0.0400,False,False,False,
610,Statue Base(?) for an Unknown Individual,Building or Monument,Dedication,,250.5,99,0.0330,False,False,False,
611,Statue Base for an Unknown Individual,Other/Fragment,Dedication,,250.5,99,0.0330,False,False,False,
612,Statue Base for an Unknown Individual,Other/Fragment,Dedication,,250.5,99,0.0570,False,False,False,
613,Statue Base(?) for an Unknown Individual,Building or Monument,Dedication,,250.5,99,0.0190,False,False,False,
614,Statue Base(?) for an Unknown Individual,Other/Fragment,Dedication,,250.5,99,0.0310,False,False,False,
615,Statue Base(?) for an Unknown Individual,Building or Monument,Dedication,,250.5,99,0.0200,False,False,False,
616,Statue Base(?) for an Unknown Individual,Base,Dedication,,250.5,99,0.0900,False,False,False,
617,Statue Base for an Unknown Individual,Base,Dedication,,250.5,99,0.0400,False,False,False,
618,Decree(?),Base,Dedication,,250.5,99,0.1450,False,False,False,
619,Dedication of a Bath,Base,Dedication,,250.5,99,0.0700,False,False,False,
620,Statue Base(?) for an Unknown Individual,Base,Other/Uncertain,,250.5,99,0.0560,True,True,True,
621,"P. Ael. Herennia, Daughter of P. Ael. Apollonios, Hearth Initiate",Base,Dedication,,200.0,50,0.0160,False,False,False,
622,"Statue Base for an Unknown Grandson of T. Kl. Sospis, Daduch",Base,Dedication,Upper Terrace,200.0,10,0.0200,False,False,False,
623,"Statue Base for a Sekoundos, Eumolpid",Base,Dedication,,200.0,10,,True,False,False,
624,Statue Base for a M. Aur. Prosdektos Pistokratous Kephalethen,Base,Dedication,Before the Telestrion,200.0,10,0.0210,False,False,False,
625,"Statue Base for M. Gavius Gallicanus, Proconsul Asiae, Eumolpid",Base,Dedication,Upper Terrace,200.0,10,0.0525,False,False,False,
626,"Statue Base for the Sophist P. Herennius Ptolemais, Son of P. Herennius, Hierokeryx",Base,Dedication,North of the Telesterion,313.0,24,0.0220,True,True,True,
627,Statue Base for P. Herennius Ptolemaios of Hermos,Base,Dedication,,313.0,24,0.0320,False,False,False,
628,"Statue Base for Xenagoras, Son of Xenagoras and Praxagora",Base,Verse,,313.0,24,0.0190,False,False,False,
629,Statue Base for an Unknown Sister of Likinios Kallistomakhos,Base,Dedication,Before the Telestrion,205.0,10,0.0285,False,False,False,
630,Statue Base for Ful. Plautianos,Base,Dedication,Before the Telestrion,204.0,2,0.0200,True,True,True,
631,Statue Base for the Hierophant Apollinarios,Base,Dedication,Before the Telestrion,210.0,10,0.0450,False,False,False,
632,"Statue Base for Kl. Menandra, Daughter of the Daduch Kl. Philippos",Base,Dedication,Before the Telestrion,210.0,10,0.0350,True,True,True,
633,"Statue Base for Rouphenia, Mother of Iul. the Hierokeryx",Base,Dedication,,217.5,15,0.0235,True,False,False,
634,"Statue Base for Ptolemaios, Son of Serenos of Gaza",Base,Dedication,,206.5,11,0.0350,True,False,False,
635,"Statue Base for Aur. Magna, Hearth-Initiate",Base,Dedication,,217.0,10,0.0280,True,False,False,
636,"Statue Base for Aur. Paramona, Daughter of Aur. Paramonos of Lamptrai, Heath-Initiate",Base,Dedication,,217.0,10,0.0225,False,True,False,
637,"Statue Base for Apollonios, Son of Apollonios, Hierophant",Base,Verse,,215.0,10,0.0320,False,False,False,
637,"Statue Base for Apollonios, Son of Apollonios, Hierophant",Base,Verse,,220.0,10,0.0320,False,False,False,
638,Decree of the Athenians Concerning the Transport of the Sacred Objects,Base,Decree,South Wall,220.0,10,0.0180,True,True,True,
639,"Statue Base for Honoratiane Polykharmis, Daughter of Honoratianos Polykharmos, Hearth-Initiate",Base,Dedication,North of the Telesterion,220.0,10,0.0250,False,False,False,
640,"Dedication Honoring an Unknown Fabius [-], Hearth Initiate",Base,Dedication,,237.5,25,0.0200,False,False,False,
641,"Statue Base for Eunike, Daughter of Kallaischoros of Phillaidai",Base,Dedication,,237.5,25,0.0230,False,False,False,
642,"Statue Base for Polyelos Xeinagorou, Hearth-Initiate",Stele,Dedication,Between the Propylaea,237.5,25,,False,False,False,
643,Edict by an Unknown Party,Base,Edict/Regulation,Between the Propylaea,230.0,10,0.0170,False,False,False,
644,Statue Base for M. Ulpios Eubiotos Leuros Gargettios,Base,Dedication,,230.0,10,0.0300,False,False,False,
645,"Statue Base for Kassianos, Hierokeryx",Base,Dedication,Before the Telestrion,236.0,10,0.0350,True,True,True,
646,"Statue Base for T. Fl. Gklaukos Glaukou Marathonios, Hierophant",Base,Verse,Before the Telestrion,235.0,10,0.0200,False,False,False,
647,Herm Dedicated to the Emperor Maximinus,Base,Dedication,,235.5,1,0.0300,False,False,False,
648,"Statue Base for Iun. Themistokleia, Daughter of Honoratiane Polykharmis, Hearth-Initiate",Base,Dedication,,240.0,10,0.0180,False,False,False,
649,Statue Base for an Unknown Hierophant,Base,Dedication,Before the Telestrion,240.0,10,0.0180,False,False,False,
650,"Statue Base for Nikagoras, Hierokeryx and Sophist",Base,Dedication,Before the Telestrion,250.0,10,0.0400,False,False,False,
651,"Dionysia, Daughter of Hermippis, Priestess of Demeter and Kore",Base,Dedication,,250.0,50,0.0360,False,False,False,
652,Statue Base for an Unknown Relative of an Orator,Base,Dedication,,250.0,50,0.0245,False,False,False,
653,"Statue Base for a Unknown T. Fl., Altar-Priest",Column/Herm,Dedication,,250.0,50,0.0250,False,False,False,
654,"Statue Base for Aerarios Sosipatros, Daduch",Base,Dedication,,275.0,50,0.0350,True,True,True,
655,Letter of the Emperor Gallienus to the Athenians Concerning the Mysteries,Base,Epistle,,265.0,0,0.0180,False,False,False,
656,"Statue Base for P. Ael. Herennius Dexippos of Hermos, Priest of the Panages",Base,Dedication,North of the Telesterion,270.0,10,0.0250,False,False,False,
657,Statue Base with a Verse Dedication to an Unknown Individual,Base,Verse,,270.0,10,0.0180,False,False,False,
658,"Dedicatory Base Set up by Initiates, Pyrros and Roupheinos",Base,Dedication,,270.0,10,0.0140,False,False,False,
659,Statue Base for Eunike Kallaiskhrou Marathoniou,Base,Verse,Before the Telestrion,287.5,25,0.0100,False,False,False,
660,Statue Base for the Emperors Diocletian and Maximianus,Base,Dedication,,295.5,19,0.0380,False,False,True,
661,Statue Base for an Unknown Proconsul,Base,Dedication,Before the Telestrion,250.0,100,0.0180,False,False,False,
662,Statue Base for an Unknown Individual,Base,Dedication,Before the Telestrion,250.0,100,0.0250,True,False,False,
663,Statue Base for an Unknown Exegete of the Eumolpidai(?),Base,Dedication,,250.0,100,0.0475,False,False,False,
664,Statue Base(?) for an Unknown Individual,Base,Other/Uncertain,,250.0,100,0.0420,False,False,False,
665,Statue Base for an Unknown Individual,Base,Dedication,,250.0,100,0.0160,False,False,False,
666,Base Dedicated by an Unknown Party,Base,Dedication,,150.5,299,,False,False,False,
667,Base Dedicated by an Unknown party,Base,Dedication,,150.5,299,,True,False,False,
668,Altar Dedicated to Kourotrophos,Base,Dedication,,150.5,299,,False,False,False,
669,Altar Dedicated to an Unknown Figure,Base,Dedication,,150.5,299,,False,False,False,
670,Base(?) Dedicated by an Unknown Party,Base,Other/Uncertain,,150.5,299,,False,False,False,
671,Base(?) Dedicated by an Unknown Party,Base,Other/Uncertain,,150.5,299,,False,False,False,
672,Fragmentary Inscription,Base,Other/Uncertain,,150.5,299,,False,False,False,
673,Base Honoring an Unknown Individual,Base,Other/Uncertain,,150.5,299,,False,False,False,
674,Fragmentary Inscription,Base,Other/Uncertain,,150.5,299,,False,False,False,
489,Declaration of the Prefect Severus Concerning an Endowment,Base,Other/Uncertain,,169.5,1,,False,False,False,
489,Decision of a Synhedrion,Base,Other/Uncertain,,169.5,1,,False,False,False,
